[
  {
    "readiness_item_id": "vol8-readiness-001",
    "phase": "Vol.8 Phase 8.5 - Future Implementation Readiness Ladder",
    "source_mapping_id": "vol8-roadmap-map-002",
    "source_mapping_category": "static_doc_refinement",
    "source_boundary_decision": "safe_to_refine_now_static_only",
    "candidate_title": "Static panel scan-order documentation refinement",
    "candidate_summary": "Clarify static shell panel scan order in local documentation only.",
    "readiness_level": "L1_static_doc_refinement_ready",
    "required_gate_type": "no_gate_static_doc_only",
    "allowed_current_action": "Refine static documentation wording for local operator scan order.",
    "disallowed_current_action": "Do not create production UI, hosted app, frontend framework, or live dashboard behavior.",
    "implementation_allowed_now": true,
    "roadmap_only": false,
    "requires_future_gate": false,
    "customer_facing_allowed_now": false,
    "network_or_api_allowed_now": false,
    "execution_or_mutation_allowed_now": false,
    "credential_or_auth_allowed_now": false,
    "affected_artifacts": ["static_shell/ldd/README.md", "static_shell/ldd/OPERATOR_WALKTHROUGH.md"],
    "recommended_next_action": "Apply only as future static documentation refinement.",
    "status": "static_doc_ready"
  },
  {
    "readiness_item_id": "vol8-readiness-002",
    "phase": "Vol.8 Phase 8.5 - Future Implementation Readiness Ladder",
    "source_mapping_id": "vol8-roadmap-map-003",
    "source_mapping_category": "static_fixture_refinement",
    "source_boundary_decision": "safe_to_refine_now_static_only",
    "candidate_title": "Static fixture timestamp explanation refinement",
    "candidate_summary": "Clarify that fixture timestamps are static evidence and not live freshness indicators.",
    "readiness_level": "L2_static_fixture_refinement_ready",
    "required_gate_type": "static_shell_qa_gate",
    "allowed_current_action": "Refine static fixture notes and fixture documentation.",
    "disallowed_current_action": "Do not add live market data, polling, API calls, or freshness checks.",
    "implementation_allowed_now": true,
    "roadmap_only": false,
    "requires_future_gate": false,
    "customer_facing_allowed_now": false,
    "network_or_api_allowed_now": false,
    "execution_or_mutation_allowed_now": false,
    "credential_or_auth_allowed_now": false,
    "affected_artifacts": ["static_shell/ldd/static_shell_data.js", "static_shell/ldd/README.md"],
    "recommended_next_action": "Apply only inside a static fixture refinement pass.",
    "status": "static_fixture_ready"
  },
  {
    "readiness_item_id": "vol8-readiness-003",
    "phase": "Vol.8 Phase 8.5 - Future Implementation Readiness Ladder",
    "source_mapping_id": "vol8-roadmap-map-006",
    "source_mapping_category": "qa_checklist_refinement",
    "source_boundary_decision": "safe_to_refine_now_static_only",
    "candidate_title": "QA checklist boundary clarity reminder",
    "candidate_summary": "Add static checklist wording that prompts reviewers to confirm boundary clarity.",
    "readiness_level": "L1_static_doc_refinement_ready",
    "required_gate_type": "no_gate_static_doc_only",
    "allowed_current_action": "Refine static QA checklist language.",
    "disallowed_current_action": "Do not add runtime tests, hosted checks, network probes, or execution validation.",
    "implementation_allowed_now": true,
    "roadmap_only": false,
    "requires_future_gate": false,
    "customer_facing_allowed_now": false,
    "network_or_api_allowed_now": false,
    "execution_or_mutation_allowed_now": false,
    "credential_or_auth_allowed_now": false,
    "affected_artifacts": ["docs/runtime/VOL8_STATIC_SHELL_QA_HANDOFF_CHECKLIST_v0.1.md"],
    "recommended_next_action": "Apply as static checklist refinement only.",
    "status": "static_doc_ready"
  },
  {
    "readiness_item_id": "vol8-readiness-004",
    "phase": "Vol.8 Phase 8.5 - Future Implementation Readiness Ladder",
    "source_mapping_id": "vol8-roadmap-map-004",
    "source_mapping_category": "terminology_alignment",
    "source_boundary_decision": "safe_to_refine_now_static_only",
    "candidate_title": "Static terminology alignment",
    "candidate_summary": "Align static shell QA, boundary freeze, and roadmap mapping terminology across docs.",
    "readiness_level": "L1_static_doc_refinement_ready",
    "required_gate_type": "no_gate_static_doc_only",
    "allowed_current_action": "Normalize wording in committed documentation and generated summaries.",
    "disallowed_current_action": "Do not expand terminology into new product capabilities.",
    "implementation_allowed_now": true,
    "roadmap_only": false,
    "requires_future_gate": false,
    "customer_facing_allowed_now": false,
    "network_or_api_allowed_now": false,
    "execution_or_mutation_allowed_now": false,
    "credential_or_auth_allowed_now": false,
    "affected_artifacts": ["docs/runtime/VOL8_STATIC_SHELL_QA_HANDOFF_CHECKLIST_v0.1.md", "docs/runtime/IMPLEMENTED_FUNCTION_FRAMEWORK_INDEX_v0.1.md"],
    "recommended_next_action": "Keep terminology alignment inside documentation-only work.",
    "status": "static_doc_ready"
  },
  {
    "readiness_item_id": "vol8-readiness-005",
    "phase": "Vol.8 Phase 8.5 - Future Implementation Readiness Ladder",
    "source_mapping_id": "vol8-roadmap-map-007",
    "source_mapping_category": "future_product_candidate",
    "source_boundary_decision": "roadmap_only_no_implementation",
    "candidate_title": "Saved feedback history roadmap candidate",
    "candidate_summary": "Retain saved feedback history as roadmap-only planning input with no current implementation approval.",
    "readiness_level": "L3_roadmap_only_no_implementation",
    "required_gate_type": "product_boundary_gate",
    "allowed_current_action": "Record as roadmap-only candidate in static planning materials.",
    "disallowed_current_action": "Do not build saved history UI, database, persistence, API, scheduler, or user accounts.",
    "implementation_allowed_now": false,
    "roadmap_only": true,
    "requires_future_gate": false,
    "customer_facing_allowed_now": false,
    "network_or_api_allowed_now": false,
    "execution_or_mutation_allowed_now": false,
    "credential_or_auth_allowed_now": false,
    "affected_artifacts": ["docs/runtime/VOL8_FEEDBACK_TO_ROADMAP_MAPPING_GUIDE_v0.1.md"],
    "recommended_next_action": "Keep as roadmap-only until a future product boundary review.",
    "status": "roadmap_only"
  },
  {
    "readiness_item_id": "vol8-readiness-006",
    "phase": "Vol.8 Phase 8.5 - Future Implementation Readiness Ladder",
    "source_mapping_id": "vol8-roadmap-map-007",
    "source_mapping_category": "future_product_candidate",
    "source_boundary_decision": "roadmap_only_no_implementation",
    "candidate_title": "Future static feedback-history prototype candidate",
    "candidate_summary": "A non-live static prototype could be considered later, but only after a future static prototype gate.",
    "readiness_level": "L4_future_static_prototype_candidate",
    "required_gate_type": "future_static_prototype_gate",
    "allowed_current_action": "Name the candidate and gate requirement in static planning notes.",
    "disallowed_current_action": "Do not create a prototype, UI, persistence, API, auth, or customer-facing workflow in this phase.",
    "implementation_allowed_now": false,
    "roadmap_only": true,
    "requires_future_gate": true,
    "customer_facing_allowed_now": false,
    "network_or_api_allowed_now": false,
    "execution_or_mutation_allowed_now": false,
    "credential_or_auth_allowed_now": false,
    "affected_artifacts": ["docs/runtime/VOL8_FUTURE_IMPLEMENTATION_READINESS_LADDER_v0.1.md"],
    "recommended_next_action": "Require a future static prototype gate before any prototype work.",
    "status": "future_gate_required"
  },
  {
    "readiness_item_id": "vol8-readiness-007",
    "phase": "Vol.8 Phase 8.5 - Future Implementation Readiness Ladder",
    "source_mapping_id": "vol8-roadmap-map-011",
    "source_mapping_category": "live_runtime_request_deferred",
    "source_boundary_decision": "defer_until_runtime_boundary_defined",
    "candidate_title": "Future runtime boundary candidate",
    "candidate_summary": "Any live/runtime behavior discussion remains deferred until a runtime boundary gate exists.",
    "readiness_level": "L5_future_runtime_candidate_requires_gate",
    "required_gate_type": "runtime_boundary_gate",
    "allowed_current_action": "Record the runtime boundary gate requirement.",
    "disallowed_current_action": "Do not add live data, runtime mutation, workers, schedulers, API calls, or hosted services.",
    "implementation_allowed_now": false,
    "roadmap_only": true,
    "requires_future_gate": true,
    "customer_facing_allowed_now": false,
    "network_or_api_allowed_now": false,
    "execution_or_mutation_allowed_now": false,
    "credential_or_auth_allowed_now": false,
    "affected_artifacts": ["docs/runtime/VOL8_FEEDBACK_TO_ROADMAP_BOUNDARY_MAP_v0.1.md"],
    "recommended_next_action": "Defer until a future runtime boundary gate is explicitly approved.",
    "status": "future_gate_required"
  },
  {
    "readiness_item_id": "vol8-readiness-008",
    "phase": "Vol.8 Phase 8.5 - Future Implementation Readiness Ladder",
    "source_mapping_id": "vol8-roadmap-map-009",
    "source_mapping_category": "forbidden_scope_rejected",
    "source_boundary_decision": "reject_forbidden_scope",
    "candidate_title": "Future network/API integration candidate requires gate",
    "candidate_summary": "Any abstract network/API integration planning requires a future integration gate and remains unimplemented now.",
    "readiness_level": "L6_future_network_api_candidate_requires_gate",
    "required_gate_type": "network_api_integration_gate",
    "allowed_current_action": "Record that network/API integration is blocked without a future integration and security gate.",